{
  "$schema": "../schemas/platform-rule-pack.schema.json",
  "schemaVersion": "platform-rule-pack.v1alpha1",
  "packId": "org.lumiclaw.platform.x",
  "platformCode": "X",
  "packVersion": "0.1.0-research",
  "status": "RESEARCH_PROTOTYPE",
  "provenance": {
    "retrievedAt": "2026-08-22T15:00:00+08:00",
    "reviewedAt": "2026-08-22T18:00:00+08:00",
    "reviewCadenceDays": 30,
    "expiresAt": "2026-09-21T15:00:00+08:00",
    "maintainer": "LumiClaw Presence"
  },
  "applicability": {
    "artifactProfileCodes": ["X_SINGLE_POST", "X_THREAD", "X_LONG_POST", "X_ARTICLE", "X_POLL", "X_VIDEO_POST"],
    "marketCodes": ["GLOBAL"],
    "localeCodes": ["*"],
    "deliveryModeCodes": ["MANUAL_DESKTOP_ASSISTANT", "X_OFFICIAL_API_POC"],
    "clientSurfaceCodes": ["WEB", "X_WEB", "X_IOS", "X_ANDROID", "X_API_V2"]
  },
  "sources": [
    {
      "sourceId": "X.HELP.POST",
      "title": "How to post",
      "url": "https://help.x.com/en/using-x/how-to-post",
      "publisher": "X",
      "authority": "PLATFORM_OFFICIAL",
      "sourceType": "HELP",
      "retrievedAt": "2026-08-22T15:00:00+08:00",
      "sourceVersion": "live-help-retrieved-2026-08-22",
      "reviewCadenceDays": 30,
      "expiresAt": "2026-09-21T15:00:00+08:00"
    },
    {
      "sourceId": "X.SPEC.TWITTER_TEXT_V3",
      "title": "twitter-text v3 configuration",
      "url": "https://github.com/twitter/twitter-text/blob/30e2430d90cff3b46393ea54caf511441983c260/config/v3.json",
      "publisher": "X / Twitter",
      "authority": "OFFICIAL_OPEN_SOURCE",
      "sourceType": "OPEN_SOURCE_SPEC",
      "retrievedAt": "2026-08-22T15:10:00+08:00",
      "sourceVersion": "v3.1.0@30e2430d90cff3b46393ea54caf511441983c260",
      "reviewCadenceDays": 90,
      "expiresAt": "2026-11-20T15:10:00+08:00"
    },
    {
      "sourceId": "X.HELP.LINKS",
      "title": "How to post a link",
      "url": "https://help.x.com/en/using-x/how-to-post-a-link",
      "publisher": "X",
      "authority": "PLATFORM_OFFICIAL",
      "sourceType": "HELP",
      "retrievedAt": "2026-08-22T15:15:00+08:00",
      "sourceVersion": "live-help-retrieved-2026-08-22",
      "reviewCadenceDays": 30,
      "expiresAt": "2026-09-21T15:15:00+08:00"
    },
    {
      "sourceId": "X.API.CREATE_POST",
      "title": "Create or edit Post",
      "url": "https://docs.x.com/x-api/posts/create-or-edit-post",
      "publisher": "X",
      "authority": "PLATFORM_OFFICIAL",
      "sourceType": "API_DOC",
      "retrievedAt": "2026-08-22T15:20:00+08:00",
      "sourceVersion": "live-api-doc-retrieved-2026-08-22",
      "reviewCadenceDays": 30,
      "expiresAt": "2026-09-21T15:20:00+08:00"
    },
    {
      "sourceId": "X.HELP.IMAGES",
      "title": "How to post pictures or GIFs",
      "url": "https://help.x.com/en/using-x/posting-gifs-and-pictures",
      "publisher": "X",
      "authority": "PLATFORM_OFFICIAL",
      "sourceType": "HELP",
      "retrievedAt": "2026-08-22T15:25:00+08:00",
      "sourceVersion": "live-help-retrieved-2026-08-22",
      "reviewCadenceDays": 30,
      "expiresAt": "2026-09-21T15:25:00+08:00"
    },
    {
      "sourceId": "X.HELP.ALT",
      "title": "How to add image descriptions",
      "url": "https://help.x.com/en/using-x/add-image-descriptions",
      "publisher": "X",
      "authority": "PLATFORM_OFFICIAL",
      "sourceType": "HELP",
      "retrievedAt": "2026-08-22T15:30:00+08:00",
      "sourceVersion": "live-help-retrieved-2026-08-22",
      "reviewCadenceDays": 30,
      "expiresAt": "2026-09-21T15:30:00+08:00"
    },
    {
      "sourceId": "X.HELP.ACCESSIBILITY",
      "title": "Accessibility features of X",
      "url": "https://help.x.com/en/using-x/accessibility-features",
      "publisher": "X",
      "authority": "PLATFORM_OFFICIAL",
      "sourceType": "HELP",
      "retrievedAt": "2026-08-22T15:35:00+08:00",
      "sourceVersion": "live-help-retrieved-2026-08-22",
      "reviewCadenceDays": 90,
      "expiresAt": "2026-11-20T15:35:00+08:00"
    },
    {
      "sourceId": "X.HELP.THREAD",
      "title": "How to create a thread on X",
      "url": "https://help.x.com/en/using-x/create-a-thread",
      "publisher": "X",
      "authority": "PLATFORM_OFFICIAL",
      "sourceType": "HELP",
      "retrievedAt": "2026-08-22T15:40:00+08:00",
      "sourceVersion": "live-help-retrieved-2026-08-22",
      "reviewCadenceDays": 30,
      "expiresAt": "2026-09-21T15:40:00+08:00"
    },
    {
      "sourceId": "X.HELP.HASHTAGS",
      "title": "How to use hashtags",
      "url": "https://help.x.com/en/using-x/how-to-use-hashtags",
      "publisher": "X",
      "authority": "PLATFORM_OFFICIAL",
      "sourceType": "HELP",
      "retrievedAt": "2026-08-22T15:45:00+08:00",
      "sourceVersion": "live-help-retrieved-2026-08-22",
      "reviewCadenceDays": 90,
      "expiresAt": "2026-11-20T15:45:00+08:00"
    },
    {
      "sourceId": "X.HELP.PREMIUM",
      "title": "About X Premium",
      "url": "https://help.x.com/en/using-x/x-premium",
      "publisher": "X",
      "authority": "PLATFORM_OFFICIAL",
      "sourceType": "HELP",
      "retrievedAt": "2026-08-22T15:50:00+08:00",
      "sourceVersion": "live-help-retrieved-2026-08-22",
      "reviewCadenceDays": 14,
      "expiresAt": "2026-09-05T15:50:00+08:00",
      "notes": "Tier and feature availability can vary by client and location."
    },
    {
      "sourceId": "X.HELP.VIDEO",
      "title": "How to share and watch videos on X",
      "url": "https://help.x.com/en/using-x/x-videos",
      "publisher": "X",
      "authority": "PLATFORM_OFFICIAL",
      "sourceType": "HELP",
      "retrievedAt": "2026-08-22T15:55:00+08:00",
      "sourceVersion": "live-help-retrieved-2026-08-22",
      "reviewCadenceDays": 14,
      "expiresAt": "2026-09-05T15:55:00+08:00",
      "notes": "This page conflicts with the Premium page on current Premium video limits."
    },
    {
      "sourceId": "X.HELP.ARTICLES",
      "title": "About Articles",
      "url": "https://help.x.com/en/using-x/articles",
      "publisher": "X",
      "authority": "PLATFORM_OFFICIAL",
      "sourceType": "HELP",
      "retrievedAt": "2026-08-22T16:00:00+08:00",
      "sourceVersion": "live-help-retrieved-2026-08-22",
      "reviewCadenceDays": 14,
      "expiresAt": "2026-09-05T16:00:00+08:00"
    },
    {
      "sourceId": "X.API.OAUTH2_PKCE",
      "title": "OAuth 2.0 Authorization Code Flow with PKCE",
      "url": "https://docs.x.com/fundamentals/authentication/oauth-2-0/authorization-code",
      "publisher": "X",
      "authority": "PLATFORM_OFFICIAL",
      "sourceType": "API_DOC",
      "retrievedAt": "2026-08-22T16:05:00+08:00",
      "sourceVersion": "live-api-doc-retrieved-2026-08-22",
      "reviewCadenceDays": 30,
      "expiresAt": "2026-09-21T16:05:00+08:00"
    },
    {
      "sourceId": "X.POLICY.AUTOMATION",
      "title": "X's automation development rules",
      "url": "https://help.x.com/en/rules-and-policies/x-automation",
      "publisher": "X",
      "authority": "PLATFORM_OFFICIAL",
      "sourceType": "POLICY",
      "retrievedAt": "2026-08-22T16:10:00+08:00",
      "sourceVersion": "updated-2026-04-retrieved-2026-08-22",
      "reviewCadenceDays": 30,
      "expiresAt": "2026-09-21T16:10:00+08:00"
    }
  ],
  "rules": [
    {
      "ruleCode": "X_REGULAR_POST_WEIGHTED_LENGTH_MAX_280",
      "classification": "HARD_CONSTRAINT",
      "severity": "BLOCK",
      "summary": "A regular Post must be at most 280 weighted characters; Unicode code-point length is not the counting algorithm.",
      "sourceIds": ["X.HELP.POST", "X.SPEC.TWITTER_TEXT_V3"],
      "appliesWhen": { "artifactProfileCode": "X_SINGLE_POST", "capability.longPost": false },
      "constraint": { "operator": "MAX", "value": 280, "unit": "X_WEIGHTED_CHARACTER", "parserProfile": "twitter-text-v3" },
      "validation": { "validatorCode": "x.weighted_text.v3", "mode": "DETERMINISTIC" },
      "fallback": { "action": "DOWNGRADE_PROFILE", "reason": "Split into an approved X thread.", "fallbackProfileCode": "X_THREAD" }
    },
    {
      "ruleCode": "X_URL_WEIGHT_FIXED_23",
      "classification": "HARD_CONSTRAINT",
      "severity": "BLOCK",
      "summary": "Each URL is wrapped by t.co and consumes 23 weighted characters regardless of displayed URL length.",
      "sourceIds": ["X.HELP.LINKS", "X.SPEC.TWITTER_TEXT_V3"],
      "appliesWhen": { "contentContains": "URL" },
      "constraint": { "operator": "EQUALS", "value": 23, "unit": "X_WEIGHTED_CHARACTER_PER_URL" },
      "validation": { "validatorCode": "x.weighted_text.v3", "mode": "DETERMINISTIC" },
      "fallback": { "action": "BLOCK", "reason": "Recalculate with the canonical weighted parser." }
    },
    {
      "ruleCode": "X_IMAGE_POST_MEDIA_COUNT_1_TO_4",
      "classification": "HARD_CONSTRAINT",
      "severity": "BLOCK",
      "summary": "An image Post may attach one to four media identifiers.",
      "sourceIds": ["X.API.CREATE_POST", "X.HELP.IMAGES"],
      "appliesWhen": { "artifactProfileCode": "X_SINGLE_POST", "mediaKind": "IMAGE" },
      "constraint": { "operator": "BETWEEN_INCLUSIVE", "minimum": 1, "maximum": 4, "unit": "IMAGE" },
      "validation": { "validatorCode": "x.media.image_count", "mode": "DETERMINISTIC" },
      "fallback": { "action": "BLOCK", "reason": "Select at most four approved images." }
    },
    {
      "ruleCode": "X_IMAGE_FILE_SIZE_MAX_5_MB",
      "classification": "HARD_CONSTRAINT",
      "severity": "BLOCK",
      "summary": "An image uploaded through the documented composer path must not exceed 5 MB.",
      "sourceIds": ["X.HELP.IMAGES"],
      "appliesWhen": { "mediaKind": "IMAGE", "clientSurfaceCode": "X_WEB" },
      "constraint": { "operator": "MAX", "value": 5242880, "unit": "BYTE" },
      "validation": { "validatorCode": "media.file_size", "mode": "DETERMINISTIC" },
      "fallback": { "action": "BLOCK", "reason": "Re-export or compress without changing the approved content." }
    },
    {
      "ruleCode": "X_THREAD_ITEM_IMAGE_COUNT_0_TO_4",